{"assurance_scope":"integrity_and_repository_policy_only","decision":"PASS","evaluated_at_utc":"2026-08-08T12:30:00Z","expected_commit":"0123456789abcdef0123456789abcdef01234567","findings":[],"integrity_status":"PASS","policy_status":"PASS","receipt_id":"sha256:76479a6c9aba612e97066c9e631ec50fee8bcc460b8dcca25d1875a451939baa","schema_version":"1.0"}
